{
  "$schema": "https://json-schema.org/draft/2020-12/schema",
  "$id": "https://willitcall.dev/schemas/result-v2.schema.json",
  "title": "willitcall result v2",
  "type": "object",
  "additionalProperties": false,
  "required": ["schema_version", "metadata", "scenarios", "totals"],
  "properties": {
    "schema_version": {
      "const": 2
    },
    "metadata": {
      "$ref": "#/$defs/run_metadata"
    },
    "scenarios": {
      "type": "array",
      "items": {
        "$ref": "#/$defs/scenario_outcome"
      }
    },
    "totals": {
      "$ref": "#/$defs/totals"
    }
  },
  "$defs": {
    "run_metadata": {
      "type": "object",
      "additionalProperties": false,
      "required": [
        "run_id",
        "timestamp",
        "willitcall_version",
        "endpoint",
        "model_id",
        "declared_quant",
        "server",
        "sampling"
      ],
      "properties": {
        "run_id": {
          "type": "string"
        },
        "timestamp": {
          "type": "string"
        },
        "willitcall_version": {
          "type": "string"
        },
        "endpoint": {
          "type": "string"
        },
        "model_id": {
          "type": "string"
        },
        "declared_quant": {
          "type": ["string", "null"]
        },
        "server": {
          "$ref": "#/$defs/server_metadata"
        },
        "environment": {
          "$ref": "#/$defs/environment_metadata"
        },
        "sampling": {
          "$ref": "#/$defs/sampling_params"
        },
        "preflight_override": {
          "$ref": "#/$defs/preflight_override"
        }
      }
    },
    "environment_metadata": {
      "type": "object",
      "additionalProperties": false,
      "required": ["host_hardware_class", "host_os"],
      "properties": {
        "host_hardware_class": {
          "type": "string",
          "minLength": 1
        },
        "host_os": {
          "type": "string",
          "minLength": 1
        }
      }
    },
    "preflight_override": {
      "type": "object",
      "additionalProperties": false,
      "required": ["forced", "foreign_endpoints"],
      "properties": {
        "forced": {
          "const": true
        },
        "foreign_endpoints": {
          "type": "array",
          "items": {
            "type": "string"
          }
        }
      }
    },
    "server_metadata": {
      "type": "object",
      "additionalProperties": false,
      "required": ["preset_name", "reported_version", "quirk_flags"],
      "properties": {
        "preset_name": {
          "type": "string"
        },
        "reported_version": {
          "type": ["string", "null"]
        },
        "quirk_flags": {
          "type": "array",
          "items": {
            "type": "string"
          }
        }
      }
    },
    "sampling_params": {
      "type": "object",
      "additionalProperties": false,
      "required": ["temperature", "top_p", "seed", "max_tokens"],
      "properties": {
        "temperature": {
          "type": ["number", "null"]
        },
        "top_p": {
          "type": ["number", "null"]
        },
        "seed": {
          "type": ["integer", "null"],
          "minimum": 0
        },
        "max_tokens": {
          "type": ["integer", "null"],
          "minimum": 0,
          "maximum": 4294967295
        }
      }
    },
    "scenario_outcome": {
      "type": "object",
      "additionalProperties": false,
      "required": [
        "id",
        "category",
        "status",
        "failure_reason",
        "evidence_hash",
        "evidence_path",
        "retried"
      ],
      "properties": {
        "id": {
          "type": "string"
        },
        "category": {
          "enum": [
            "single_call",
            "parallel_calls",
            "streaming",
            "tool_choice_modes",
            "multi_turn",
            "negative_trap"
          ]
        },
        "status": {
          "enum": ["pass", "fail", "error", "skipped"]
        },
        "failure_reason": {
          "type": ["string", "null"]
        },
        "failure_class": {
          "description": "Single mechanical classification for an already-failing scenario. Precedence: error status > empty_response > unparsed_tool_call > plain fail with no failure_class. Classification never changes status.",
          "enum": ["empty_response", "unparsed_tool_call"]
        },
        "cause": {
          "$ref": "#/$defs/cause"
        },
        "evidence_hash": {
          "description": "SHA-256 of the bytes of the referenced transcript file, prefixed with sha256:.",
          "type": ["string", "null"]
        },
        "evidence_path": {
          "description": "Transcript path relative to the result file's parent directory.",
          "type": ["string", "null"]
        },
        "retried": {
          "type": "boolean"
        }
      }
    },
    "cause": {
      "type": "object",
      "additionalProperties": false,
      "required": ["kind", "reference", "note"],
      "properties": {
        "kind": {
          "enum": ["server-defect", "unknown"]
        },
        "reference": {
          "type": ["string", "null"]
        },
        "note": {
          "type": ["string", "null"]
        }
      }
    },
    "totals": {
      "type": "object",
      "additionalProperties": false,
      "required": ["total", "passed", "failed", "errors", "skipped"],
      "properties": {
        "total": {
          "type": "integer",
          "minimum": 0,
          "maximum": 4294967295
        },
        "passed": {
          "type": "integer",
          "minimum": 0,
          "maximum": 4294967295
        },
        "failed": {
          "type": "integer",
          "minimum": 0,
          "maximum": 4294967295
        },
        "errors": {
          "type": "integer",
          "minimum": 0,
          "maximum": 4294967295
        },
        "skipped": {
          "type": "integer",
          "minimum": 0,
          "maximum": 4294967295
        }
      }
    }
  }
}
